{"anchor_backend":"transparency_log","hash_algorithm":"sha256","hash_algorithm_version":"1","org_id":"c16922ef-95de-4d43-ac62-a279fac7e14f","payload_hash":"d3babd2037014f64b8a9c529ac0ae3dd5a4ea1cfb88bb8a6d4bbccc71c73cc5c","receipt_id":"tlog-2026-03-01-000001","receipt_signature":"MEUCIQDkX2e5p7f8g9h0i1j2k3l4m5n6o7p8q9r0s1t2u3v4w5x6y7z8A9B0C1D2E3F4G5H6I7J8K9L0M1N2O3P4Q5R6S7T8U9V0W1X2Y3Z4a5b6c7d8e9f0==","receipt_timestamp":"2026-03-01T12:00:00Z","schema_version":"1.0.0","spec_id":"anchor-receipt","transparency_log_index":12345678}